{
  "schema_version": 1,
  "id": "lckfb-esp32s3",
  "vendor": "LCKFB",
  "model": "立创·实战派 ESP32-S3",
  "revision": "V1.0.1",
  "platform": "esp-idf",
  "target": "esp32s3",
  "sdk": {"name": "ESP-IDF", "version": "5.5.5"},
  "project_dir": "firmware/esp-idf/esp32s3/lckfb-esp32s3-xiaotai",
  "capabilities": ["aec", "audio", "buttons", "camera-mjpeg", "display", "touch", "wifi"],
  "resources": {"flash_bytes": 16777216, "psram_bytes": 8388608},
  "evidence": {
    "hardware_ir": "firmware/esp-idf/esp32s3/lckfb-esp32s3-xiaotai/hardware-ir.json"
  },
  "variants": [{"name": "default", "default": true, "interaction_profile": "touch-full", "layout_profile": "compact"}],
  "migration": {"stage": "platform-project"}
}
